{
  "id": "stirnradgetriebe",
  "title": "Stirnradgetriebe",
  "level": 2,
  "buildResult": "Ein 3D-gedrucktes, drehbares Getriebe mit einer von dir gewählten Übersetzung.",
  "challenge": "Baue ein Getriebe, das die Drehzahl eines Motors auf ein Drittel senkt und dafür das Drehmoment erhöht.",
  "prerequisites": ["flaschenzug-hebel"],
  "conceptsIntroduced": ["zahnrad", "zaehnezahl", "uebersetzung", "modul", "teilkreisdurchmesser", "achsabstand", "wirkungsgrad"],
  "steps": [
    {
      "id": "uebersetzung",
      "title": "Die Übersetzung verstehen",
      "goal": "Verstehen, wie zwei Zahnräder Drehzahl gegen Drehmoment tauschen, und i aus den Zähnezahlen berechnen.",
      "estMinutes": 8,
      "blocks": [
        {
          "type": "text",
          "introduces": ["zahnrad", "zaehnezahl", "uebersetzung"],
          "uses": ["drehmoment"],
          "layers": {
            "intuitive": "Stell dir zwei Zahnräder vor, die ineinandergreifen – ein kleines und ein großes. Dreht das kleine flink zehnmal, schafft das große vielleicht nur dreimal. Klingt nach einem schlechten Deal? Ist es nicht: dafür drückt das große mit viel mehr Kraft. Genau dieses Tauschgeschäft – Tempo gegen Kraft – nennt man Übersetzung.",
            "practical": "Die Übersetzung i sagt dir, um welchen Faktor sich Drehzahl und Drehmoment ändern. Du liest sie direkt aus den Zähnezahlen ab: i = z₂/z₁. Ist i = 3, dreht das Abtriebsrad dreimal langsamer und liefert (fast) das dreifache Drehmoment.",
            "rigorous": "Am Eingriffspunkt haben beide Räder dieselbe Umfangsgeschwindigkeit, also z₁·n₁ = z₂·n₂. Daraus folgt i = n₁/n₂ = z₂/z₁. Weil Leistung (bis auf Verluste) erhalten bleibt und P = M·ω gilt, wächst das Drehmoment im selben Verhältnis: M₂ = M₁·i·η. Das Übersetzungsverhältnis i ist dimensionslos."
          }
        },
        {
          "type": "formula",
          "formulaId": "ratio",
          "note": "Tippe auf z₁ oder z₂, um zu sehen, was die Variablen bedeuten."
        },
        {
          "type": "interactive",
          "componentId": "gear-pair",
          "params": { "z1": 20, "z2": 60, "m": 2, "z1Range": [12, 80], "z2Range": [12, 120], "mRange": [1, 4] },
          "caption": "Schiebe die Zähnezahlen und sieh zu, wie sich i und die Räder verändern."
        },
        {
          "type": "calc",
          "formulaId": "ratio",
          "inputs": { "z2": 60, "z1": 20 },
          "expected": { "value": 3, "unit": "-" },
          "narrative": "Mit z₁ = 20 und z₂ = 60 ergibt sich i = 60/20 = 3. Das Abtriebsrad dreht also dreimal langsamer – genau das, was die Challenge verlangt."
        },
        {
          "type": "check",
          "kind": "numeric",
          "question": "Ein Getriebe hat z₁ = 15 und z₂ = 45. Wie groß ist die Übersetzung i?",
          "answer": 3,
          "tolerance": 0.01,
          "unit": "-",
          "explanation": "i = z₂/z₁ = 45/15 = 3. Same Spiel, andere Zahlen – die Übersetzung hängt nur vom Verhältnis ab, nicht von den absoluten Zähnezahlen."
        }
      ]
    }
  ]
}
