{
  "id": "stirnradgetriebe",
  "title": "Stirnradgetriebe",
  "level": 2,
  "buildResult": "Ein 3D-gedrucktes, drehbares Getriebe mit einer von dir gewählten Übersetzung.",
  "challenge": "Baue ein Getriebe, das die Drehzahl eines Motors auf ein Drittel senkt und dafür das Drehmoment erhöht.",
  "prerequisites": ["flaschenzug-hebel"],
  "conceptsIntroduced": ["zahnrad", "zaehnezahl", "uebersetzung", "modul", "teilkreisdurchmesser", "achsabstand", "wirkungsgrad"],
  "steps": [
    {
      "id": "uebersetzung",
      "title": "Die Übersetzung verstehen",
      "goal": "Verstehen, wie zwei Zahnräder Drehzahl gegen Drehmoment tauschen, und i aus den Zähnezahlen berechnen.",
      "estMinutes": 8,
      "blocks": [
        {
          "type": "text",
          "introduces": ["zahnrad", "zaehnezahl", "uebersetzung"],
          "uses": ["drehmoment"],
          "layers": {
            "intuitive": "Stell dir zwei Zahnräder vor, die ineinandergreifen – ein kleines und ein großes. Dreht das kleine flink zehnmal, schafft das große vielleicht nur dreimal. Klingt nach einem schlechten Deal? Ist es nicht: dafür drückt das große mit viel mehr Kraft. Genau dieses Tauschgeschäft – Tempo gegen Kraft – nennt man Übersetzung.",
            "practical": "Die Übersetzung i sagt dir, um welchen Faktor sich Drehzahl und Drehmoment ändern. Du liest sie direkt aus den Zähnezahlen ab: i = z₂/z₁. Ist i = 3, dreht das Abtriebsrad dreimal langsamer und liefert (fast) das dreifache Drehmoment.",
            "rigorous": "Am Eingriffspunkt haben beide Räder dieselbe Umfangsgeschwindigkeit, also z₁·n₁ = z₂·n₂. Daraus folgt i = n₁/n₂ = z₂/z₁. Weil Leistung (bis auf Verluste) erhalten bleibt und P = M·ω gilt, wächst das Drehmoment im selben Verhältnis: M₂ = M₁·i·η. Das Übersetzungsverhältnis i ist dimensionslos."
          }
        },
        {
          "type": "formula",
          "formulaId": "ratio",
          "note": "Tippe auf z₁ oder z₂, um zu sehen, was die Variablen bedeuten."
        },
        {
          "type": "interactive",
          "componentId": "gear-pair",
          "params": { "z1": 20, "z2": 60, "m": 2, "z1Range": [12, 80], "z2Range": [12, 120], "mRange": [1, 4] },
          "caption": "Schiebe die Zähnezahlen und sieh zu, wie sich i und die Räder verändern."
        },
        {
          "type": "calc",
          "formulaId": "ratio",
          "inputs": { "z2": 60, "z1": 20 },
          "expected": { "value": 3, "unit": "-" },
          "narrative": "Mit z₁ = 20 und z₂ = 60 ergibt sich i = 60/20 = 3. Das Abtriebsrad dreht also dreimal langsamer – genau das, was die Challenge verlangt."
        },
        {
          "type": "check",
          "kind": "numeric",
          "question": "Ein Getriebe hat z₁ = 15 und z₂ = 45. Wie groß ist die Übersetzung i?",
          "answer": 3,
          "tolerance": 0.01,
          "unit": "-",
          "explanation": "i = z₂/z₁ = 45/15 = 3. Same Spiel, andere Zahlen – die Übersetzung hängt nur vom Verhältnis ab, nicht von den absoluten Zähnezahlen."
        }
      ]
    },
    {
      "id": "zahnrad-bauen",
      "title": "Dein Zahnrad parametrisieren",
      "goal": "Aus Modul und Zähnezahl ein druckbares Stirnrad erzeugen und als STL herunterladen.",
      "estMinutes": 6,
      "blocks": [
        {
          "type": "text",
          "uses": ["modul", "zaehnezahl", "teilkreisdurchmesser"],
          "layers": {
            "intuitive": "Genug gerechnet – jetzt baust du. Schiebe Modul und Zähnezahl und sieh zu, wie dein Zahnrad wächst und neue Zähne bekommt. Passt es? Dann lädst du es als druckfertige Datei herunter und baust weiter.",
            "practical": "Das Modul m bestimmt die Zahngröße, die Zähnezahl z den Umfang. Beide zusammen ergeben den Teilkreisdurchmesser d = m·z – das Maß, an dem du das Rad auslegst. Die Vorschau und die STL-Datei stammen aus genau demselben parametrischen Modell.",
            "rigorous": "Das Bauteil entsteht parametrisch aus einem einzigen OpenSCAD-Modell: m und z treiben Teil-, Kopf- und Fußkreis (Addendum m, Dedendum 1,25·m, Eingriffswinkel 20°). Vorschau (isometrische Projektion) und Export (STL) leiten sich aus derselben Geometrie ab – es gibt kein zweites Modell."
          }
        },
        {
          "type": "build",
          "cadModel": "gear",
          "parameters": {
            "m": { "min": 1, "max": 4, "default": 2, "unit": "mm", "label": "Modul" },
            "z": { "min": 12, "max": 40, "default": 20, "unit": "-", "label": "Zähnezahl" },
            "thickness": { "min": 3, "max": 16, "default": 8, "unit": "mm", "label": "Breite" },
            "bore": { "min": 2, "max": 10, "default": 5, "unit": "mm", "label": "Bohrung" }
          },
          "exports": ["stl"],
          "bom": ["1× Stirnrad (gedruckt)", "1× Achse"]
        }
      ]
    }
  ]
}
