{
  "id": "_demo",
  "title": "Demo: Zahnräder lesen",
  "level": 1,
  "buildResult": "Ein Gespür dafür, wie zwei Zahnräder Tempo gegen Kraft tauschen — die Grundlage für das spätere Stirnradgetriebe.",
  "challenge": "Lies aus zwei Zähnezahlen ab, wie stark ein Getriebe untersetzt, und bestimme den Teilkreisdurchmesser eines Rads.",
  "prerequisites": [],
  "conceptsIntroduced": ["zahnrad", "zaehnezahl", "uebersetzung", "modul", "teilkreisdurchmesser"],
  "steps": [
    {
      "id": "uebersetzung",
      "title": "Die Übersetzung verstehen",
      "goal": "Die Übersetzung i aus den Zähnezahlen zweier Räder ablesen.",
      "estMinutes": 6,
      "blocks": [
        {
          "type": "text",
          "introduces": ["zahnrad", "zaehnezahl", "uebersetzung"],
          "uses": ["drehmoment"],
          "layers": {
            "intuitive": "Zwei Zahnräder greifen ineinander — ein kleines und ein großes. Dreht das kleine flink, schafft das große nur gemächlich. Klingt unfair, ist es aber nicht: dafür drückt das große mit deutlich mehr Kraft. Dieses Tauschgeschäft Tempo gegen Kraft heißt Übersetzung.",
            "practical": "Die Übersetzung i sagt dir, um welchen Faktor sich Drehzahl und Drehmoment ändern. Du liest sie direkt aus den Zähnezahlen ab: i = z₂/z₁. Bei i = 3 dreht das Abtriebsrad dreimal langsamer und liefert (bis auf Reibung) das dreifache Drehmoment.",
            "rigorous": "Am Eingriffspunkt haben beide Räder dieselbe Umfangsgeschwindigkeit, also z₁·n₁ = z₂·n₂. Daraus folgt i = n₁/n₂ = z₂/z₁. Die Übersetzung ist dimensionslos und hängt allein vom Verhältnis der Zähnezahlen ab."
          }
        },
        {
          "type": "formula",
          "formulaId": "ratio",
          "note": "Tippe auf z₁ oder z₂, um zu sehen, was die Variablen bedeuten."
        },
        {
          "type": "calc",
          "formulaId": "ratio",
          "inputs": { "z2": 60, "z1": 20 },
          "expected": { "value": 3, "unit": "-" },
          "narrative": "Mit z₁ = 20 und z₂ = 60 ergibt sich i = 60/20 = 3 — das Abtriebsrad dreht also dreimal langsamer."
        },
        {
          "type": "check",
          "kind": "numeric",
          "question": "Ein Getriebe hat z₁ = 15 und z₂ = 45. Wie groß ist die Übersetzung i?",
          "answer": 3,
          "tolerance": 0.01,
          "unit": "-",
          "explanation": "i = z₂/z₁ = 45/15 = 3. Andere Zahlen, gleiches Verhältnis — die Übersetzung hängt nur vom Verhältnis ab."
        }
      ]
    },
    {
      "id": "teilkreis",
      "title": "Der Teilkreisdurchmesser",
      "goal": "Den Teilkreisdurchmesser eines Rads aus Modul und Zähnezahl berechnen.",
      "estMinutes": 5,
      "blocks": [
        {
          "type": "text",
          "introduces": ["modul", "teilkreisdurchmesser"],
          "uses": ["zaehnezahl"],
          "layers": {
            "intuitive": "Wie groß ein Zahnrad wirklich ist, verraten nicht die Zähne allein, sondern ihre Größe — das Modul. Großes Modul, dicke Zähne, großes Rad. Multiplizierst du das Modul mit der Zähnezahl, bekommst du den gedachten Kreis, an dem sich zwei Räder gerade berühren.",
            "practical": "Der Teilkreisdurchmesser ist d = m·z. Damit zwei Räder sauber kämmen, müssen sie dasselbe Modul m haben — nur dann passen die Zähne ineinander.",
            "rigorous": "Der Teilkreis ist der Wälzkreis, auf dem das Übersetzungsverhältnis exakt gilt. Mit dem Modul m (Teilung p = π·m) und der Zähnezahl z folgt d = m·z. Gleiches Modul beider Räder ist Bedingung für formschlüssigen Eingriff."
          }
        },
        {
          "type": "formula",
          "formulaId": "pitch_d",
          "note": "Das Modul m ist in Millimetern angegeben; d kommt damit ebenfalls in mm heraus."
        },
        {
          "type": "calc",
          "formulaId": "pitch_d",
          "inputs": { "m": 2, "z": 20 },
          "expected": { "value": 40, "unit": "mm" },
          "narrative": "Bei Modul m = 2 mm und z = 20 Zähnen ist der Teilkreisdurchmesser d = 2·20 = 40 mm."
        },
        {
          "type": "check",
          "kind": "single",
          "question": "Warum müssen zwei kämmende Zahnräder dasselbe Modul haben?",
          "options": [
            "Damit sie gleich viele Zähne haben.",
            "Damit ihre Zähne gleich groß sind und sauber ineinandergreifen.",
            "Damit sie sich gleich schnell drehen.",
            "Das Modul muss gar nicht gleich sein."
          ],
          "answer": 1,
          "explanation": "Das Modul ist das Maß für die Zahngröße. Nur bei gleichem Modul passen die Zähne formschlüssig zusammen — die Zähnezahlen dürfen ruhig verschieden sein."
        }
      ]
    },
    {
      "id": "hebel",
      "title": "Kraft, Hebel, Drehmoment",
      "goal": "Verstehen, wie Kraft und Hebelarm zusammen das Drehmoment bestimmen.",
      "estMinutes": 7,
      "blocks": [
        {
          "type": "text",
          "introduces": ["hebelarm", "drehmoment"],
          "uses": ["kraft"],
          "layers": {
            "intuitive": "Ein Zahnrad überträgt nicht nur Drehung, sondern auch Kraft — und zwar über einen Hebel. Drückst du weiter außen, wirkt dieselbe Kraft viel stärker. Genau dieses Zusammenspiel aus Kraft und Hebelarm spürst du gleich am Slider: Schieb die Kraft hoch oder den Hebel länger, und die Drehwirkung wächst sichtbar.",
            "practical": "Das Drehmoment M ist Kraft mal Hebelarm: M = F·r. Verdoppelst du die Kraft oder den Hebelarm, verdoppelt sich das Drehmoment. Am Zahnrad ist der Hebelarm der Teilkreisradius — darum überträgt ein größeres Rad bei gleicher Umfangskraft mehr Moment.",
            "rigorous": "Das Moment einer Kraft um eine Achse ist M = F·r, wobei r der senkrechte Abstand der Wirkungslinie von der Achse ist. Es ist eine vektorielle Größe (Kreuzprodukt r × F); im ebenen Fall genügt der Betrag. Einheit: N·m. Im Gleichgewicht gilt ΣM = 0."
          }
        },
        {
          "type": "formula",
          "formulaId": "torque_lever",
          "note": "Tippe auf F oder r, um zu sehen, was die Variablen bedeuten."
        },
        {
          "type": "interactive",
          "componentId": "lever-slider",
          "params": {
            "formulaId": "torque_lever",
            "forceVar": "F",
            "armVar": "r",
            "force": 100,
            "arm": 0.5,
            "forceRange": [0, 500],
            "armRange": [0, 2]
          },
          "caption": "Schieb Kraft und Hebelarm — das Drehmoment rechnet die Engine live (M = F·r)."
        },
        {
          "type": "calc",
          "formulaId": "torque_lever",
          "inputs": { "F": 100, "r": 0.5 },
          "expected": { "value": 50, "unit": "N*m" },
          "narrative": "Mit F = 100 N am Hebelarm r = 0,5 m ergibt sich M = 100·0,5 = 50 N·m."
        },
        {
          "type": "check",
          "kind": "numeric",
          "question": "Du drückst mit F = 200 N an einem Hebelarm von r = 0,25 m. Wie groß ist das Drehmoment M?",
          "answer": 50,
          "tolerance": 0.01,
          "unit": "N*m",
          "explanation": "M = F·r = 200·0,25 = 50 N·m. Gleiche Drehwirkung wie 100 N am doppelten Hebel — Kraft und Hebelarm tauschen sich gegeneinander aus."
        }
      ]
    },
    {
      "id": "zahnrad-bauen",
      "title": "Dein Zahnrad parametrisieren",
      "goal": "Aus Modul und Zähnezahl ein druckbares Stirnrad erzeugen und als STL herunterladen.",
      "estMinutes": 6,
      "blocks": [
        {
          "type": "text",
          "uses": ["modul", "zaehnezahl", "teilkreisdurchmesser"],
          "layers": {
            "intuitive": "Genug gelesen – jetzt baust du. Schieb Modul und Zähnezahl und sieh zu, wie dein Zahnrad wächst und neue Zähne bekommt. Dreh es mit dem Ansicht-Slider und lade es als druckfertige Datei herunter.",
            "practical": "Modul m und Zähnezahl z bestimmen den Teilkreisdurchmesser d = m·z – das Maß, an dem du das Rad auslegst. Vorschau und STL-Datei stammen aus genau demselben parametrischen Modell.",
            "rigorous": "Das Bauteil entsteht parametrisch aus einem einzigen OpenSCAD-Modell (Addendum m, Dedendum 1,25·m, Eingriffswinkel 20°). Isometrische Vorschau und STL-Export leiten sich aus derselben Geometrie ab – es gibt kein zweites Modell."
          }
        },
        {
          "type": "build",
          "cadModel": "gear",
          "parameters": {
            "m": { "min": 1, "max": 4, "default": 2, "unit": "mm", "label": "Modul" },
            "z": { "min": 12, "max": 40, "default": 20, "unit": "-", "label": "Zähnezahl" },
            "thickness": { "min": 3, "max": 16, "default": 8, "unit": "mm", "label": "Breite" },
            "bore": { "min": 2, "max": 10, "default": 5, "unit": "mm", "label": "Bohrung" }
          },
          "exports": ["stl"],
          "bom": ["1× Stirnrad (gedruckt)", "1× Achse"]
        }
      ]
    }
  ]
}
